ما عدتُّ أفرق بين الحلم والواقع، ربما لأن كثيرا من أحلامي أراها تتحقق في واقعي، أو أن كثيرا من الوقائع حولي لا تتحقق إلا في الأحلام .,5
مشكلة النفس أنها حين تتهم نفسها بالتقصير ترضى، وفى هذا تلبيسٌ خفيٌ ؛ فمنّا من يخاف التقصير وله حسن ثواب الآخرة، ومنّا من هو أعظم خوفا وما له في الآخرة من نصيب.,1
مشكلتك يا مسكين أنك تقيس نفسك على أمثالك ولو أنك تضعنا مقياسا ومثالا _نحن الأموات_ لاختلف حالك أيما اختلاف.,3
مشكلتكم أنكم انشغلتم بتفاصيل الدنيا عن الآخرة، وبالمخلوقات عن الخالق، حتى أنكم في صلاتكم لتفكرون في كل شيء عدا المعبود، ولو أنكم أيقنتم أنكم عن هذه الدنيا راحلون، وأنكم أدوات تصيغون التفاصيل ليس إلا، وأننا جميعا نتحرك بأمر الله، وانشغلتم بالآمر عن المأمور، لسخر الله لكم الدنيا وما فيها عند أقدامكم، ولوجدتم لكل مشكلة حلا، ولكل ضيق مخرجا م، حتى أنكم لتحسبون أن هذه الدنيا كلها قد فُصلت لأجلكم تفصيلا.,3
من أغدق أخاهُ بكلامٍ ينمّ عن حبّه ، فإمّا لأن أفعاله تظهر تقصيرًا في حبّه فهو يعوّضها بالكلام وإمّا لأنّه شديد الحب والتعلق بأخيه ، وتلك أسمى مراتبُ الحب.,4
من بخل على أخيه بكلمة تدلّ على الحب فإمّا لعجزه عن التعبير أو أنه لا يستطيع أن ينطق بما ليس في قلبه ، أو أن تلك الكلمة باهظة الثّمن فلا يتلفّظ بها إلّا عند الحاجة الشديدة وبصِدق ليُثبت حبّه !,4
من طالب أخاه بسماع كلمة تدلّ على حبه فهو سقيمٌ يرضى بالظاهر من الأشياء دون باطنِها ، فحبّ المرء لا يتجلّى في أقواله.,4
من لم يهب حياته كلها لله من البداية محالٌ أن يهبها مجزوءة مقطعة.,1
من يدري متى الكلمةُ التي فيها نجاتُك ، وأين ، بل ولمن تكون ؟,6
من يزعم أن حياته كلها لله، فعليه أن يتذكر عظمة الله وقدرته  وحكمته، في شربته ونومته وقومته وخلوته وجلوته، وأن مردّ كل شيء إلى الله، وأنه أقرب إليه من حبل الوريد، فلا يخدع نفسه بمحاولة هزيلة قبل كل عمل يجدد فيها نيته، فمن لم يهب حياته كلها لله من البداية محالٌ أن يهبها مجزوءة مقطعة وإن كان لابد له من مجدد من آن لآخر.,1
منا من هو سائرٌ إلى الله تذكُرُه الدنيا أحيانا، ومنا من هو سائرٌ إلى الدنيا يذكر الله أحيانا.,1
نحن نفجر فيك مكامن الشعور، ونطوي ساعات الزمن، لنبث فيك بعضا من الحماسة اللاهبة، ثم كلٌ يتحرك بعد ذلك بقدر ما تحرق.,3
نريد أن نكون أفضل(فقط) ليقتدى بنا، فلا يُفعل، ولو أخلصنا لله في إرادتنا تلك لأحسَّ الناس بنور الصدق يفيض من جوانحنا ،وكثيرا ما تجد جنديا متميزا مؤثرا، يقتدى به الكل ويحبونه، فيُختار قائدا، فيحرص أن يظل قدوة، وهو بحرصه على ألا يفقدها /  يفقدها وإنها لمعادلة صعبة، لا يفطن إليها إلا صاحب قلبٍ سليم، أو ذلك الجندي المسكين بعد أن يفقدها ولا حول ولا قوة إلا بالله.,1
نصف حلم عظيم ؛ هو حلم عظيم لنصف رجل.,5
هناك شيئًا أفعله لا يعرفه الكثيرون ، إنني لا أتوقف عن الكتابة يوميًا ، لكنني أنشر شيئا من مائة شيء أكتبه ،وأبعث ببعض ما أكتب لأساتذتي لأخذ مشورتهم ... لعل وعسى .,3
وإذا سئلت عن حلمك فاصدح به ولا تخجل، فإنه لن يحاسبك على حلمك العظيم، إلا صاحب حلم أعظم .,5
وإنّ حُب المرء لِأخيه إنّما يتجلّى في أفعاله لا فى أقواله ، فمن دلّت أفعالُه على حُبّه وقلّ كلامه فاعلم أنّه يحبّ في الله لكنّه يعجز عن وصف حبّه ، ومن دلّت أقواله على حبّه وقلّت أفعاله فاعلم أنّه متكلّمٌ بارع لا يبغي من الصداقةِ إلّا التسلية ، أمّا من دلّت أفعاله وأقواله على حبّه ، فإنّها أسمى مراتبُ الحبّ .,4
وإن مقياسك الحقيقي يا ولدي لا يظهر وأنت وسط صفوف الدعاة يذكرونك كلما نسيت،أو وسط أحداث يومية تأخذك كلما شردت، إن أردت أن تعلم إلى أين وصلت في معنانا هذا : فقس نفسك عندما تكون وحيدا يملؤك الفراغ، ما يشغلك وقتها ؟,3
واعلم أن أروع الأحلام وأعظمها هي تلك التي تتمدد بتمدد الزمن . ,5
واعلم أن صناعة الرجال من صناعة الأحلام.,5
وعجبي لحالي إن أضعت دقيقة من وقتي أو شعورا في غير محرقة أو غضبة لله، أو تفكيرا في غير رضاه وابتغاء علاه والتمكين لدينه، لو أملك ألف نفسا لأزهقتها كلها لله، ولو أملك ألف عقل لسخرته كله لنصرة دينه، ولو أملك ألف جسد لأتلفته كله ابتغاء مرضاته.,7
ولدي ؛لا تشغل نفسك كثيرا بتحضير الكلمات والرسائل لترد لأخيك الجميل، إن خير جميل ترده له أن تشغل نفسك بوقع كلماته في نفسك، بالصورة التي ظل يحلم لك بها !! فيكون قد أخلص في تهذيبك، وتكون قد أخلصت في الوفاء له.,3
ولكي تحقق حلمك، لابد أن تحملهم عليه وتقنعهم به، بل لابد أن يحلموا به كما تحلم، وأن يكونوا على استعداد للتضحية بأموالهم وأنفسهم كما تفعل ،عندها فقط قد بدأت تخطو بخطوات ثابتة حقيقية قوية.,5
وما تنتظر منا أن نخبرك كيف يختارك الله أنت دون بقية خلقه، وما تنتظر منا أن نخبرك كيف تكون أحب عباد الله إلى الله، فذلك شأنك، يتقدم فيه من تقدم، ويتأخر عنه من تأخر، يقرأ الكلمات من يقرؤها ليستمتع بألفاظها ومعانيها، ويقرؤها من لا يغمض له جفن بعدها.,3
وما جدوى الحبّ إن كان من قلبٍ واحد ؟!,4
يا فتى! الألم في سبيل الله أحب إليه من ألف طاعة، أفلا يكون أجدر بالكتمان والمراجعة ؟!,2
يا فتى! مثلما وجب علينا أن نجدد نوايانا كثيرا عند طلب الشهادة مخافة الرياء، فكذاك الحال عند الألم، فهناك من يتألم لله صدقا، وهناك من يتألم حقيقة ولكنه بآلامه يراءي.,1
يا فتي! اجعل لآلامك نصيبا خالصا بينك وبين ربك، ولا تجعل شيئا يفسد عليك ألمك.,3
يا ليتني أسرعُ الناسِ نسيانًا ، أو أقساهم قلبًا ، لمَا عانيتُ مثلما عانيتُ ولما بكيتُ مثلما بكيت.,4
"يا مسكين، أما سمعت سيدنا علي -كرّم الله وجهه- يقول : ""والله لو كُشف الغطاء ما ازددت يقينًا، ولو علمت أن غدًا أجلي ما قدرت أن أزيد في عملي شيئا"" فذلك رجل كان ينتظر الموت كل يوم!",3
يُحكى أن رجلا أُعجب به أهل الأرض، لصلاح شأنه، وتفرد أمره، فذاع صيته في كل مكان، لكنهم لم يعلموا من أمر نفسه ما علمه أهل السماء، فافتُتنوا به، وفُتن بهم، وعندما مات بكاه أهل الأرض ولم يبكه أهل السماء، وإن كان بكاؤهم لفراقه شديدا، فلو علموا أنّه من أهل النار، لكان بكاؤهم أشد،ولا حول ولا قوة إلا بالله .,1